<?xml version="1.0" encoding="utf-8"?>
<RestAppSettings AccessLogLevel="Info" ExternalRestUrl="https://geo.caymanlandinfo.ky/Geocortex/Essentials/REST " SiteThumbnailsGenerated="true" SystemLogLevel="Warn" xmlns:xsi="http://www.w3.org/2001/XMLSchema-instance" xsi:noNamespaceSchemaLocation=".\RestAppSettings.xsd">
  <ServiceConnections>
    <ArcGisServer EnableLayerSearch="false" EnableUserSearch="false" ID="8" Password="Iqy3QmYQQzkWV3d3ky3NCA==" PasswordEncrypted="true" TokenUrl="https://adapter.caymanlandinfo.ky/secure/tokens/token" Url="https://adapter.caymanlandinfo.ky/secure/rest/services/" UseHttpAuthentication="false" Username="SUBSCRIBER" />
    <ArcGisServer EnableLayerSearch="false" EnableUserSearch="false" ID="9" PasswordEncrypted="false" Url="https://adapter.caymanlandinfo.ky/ngis/rest/services/" UseHttpAuthentication="false" />
  </ServiceConnections>
  <Modules></Modules>
  <Modules>
    <GeoRestShaper>
      <Forwarder Address="local-proxy/_Master/Basemap_Navigation/Basemap_Navigation/{type}/{*path}">
        <Authentication Mode="PassThrough" />
        <RemoteEndpoint BaseAddress="https://adapter.caymanlandinfo.ky/ngis/rest/services/Basemap_Navigation" Address="{type}/{*path}" />
      </Forwarder>
    </GeoRestShaper>
  </Modules>
  <Modules>
    <GeoRestShaper>
      <Forwarder Address="local-proxy/_Master/Basemap_Terrain_DTM_2013/Basemap_Terrain_DTM_2013/{type}/{*path}">
        <Authentication Mode="PassThrough" />
        <RemoteEndpoint BaseAddress="https://adapter.caymanlandinfo.ky/secure/rest/services/Basemap_Terrain_DTM_2013" Address="{type}/{*path}" />
      </Forwarder>
    </GeoRestShaper>
  </Modules>
  <Modules>
    <GeoRestShaper>
      <Forwarder Address="local-proxy/_Master/Basemap_Aerial_2013/Basemap_Aerial_2013/{type}/{*path}">
        <Authentication Mode="PassThrough" />
        <RemoteEndpoint BaseAddress="https://adapter.caymanlandinfo.ky/secure/rest/services/Basemap_Aerial_2013" Address="{type}/{*path}" />
      </Forwarder>
    </GeoRestShaper>
  </Modules>
  <Modules>
    <GeoRestShaper>
      <Forwarder Address="local-proxy/_Master/Basemap_Cadastral/Basemap_Cadastral/{type}/{*path}">
        <Authentication Mode="PassThrough" />
        <RemoteEndpoint BaseAddress="https://adapter.caymanlandinfo.ky/secure/rest/services/Basemap_Cadastral" Address="{type}/{*path}" />
      </Forwarder>
    </GeoRestShaper>
  </Modules>
  <Modules>
    <GeoRestShaper>
      <Forwarder Address="local-proxy/_Master/Basemap_FeaturesOverlay/Basemap_FeaturesOverlay/{type}/{*path}">
        <Authentication Mode="PassThrough" />
        <RemoteEndpoint BaseAddress="https://adapter.caymanlandinfo.ky/secure/rest/services/Basemap_FeaturesOverlay" Address="{type}/{*path}" />
      </Forwarder>
    </GeoRestShaper>
  </Modules>
  <Modules>
    <GeoRestShaper>
      <Shaper Address="local-proxy/_Master/Layers_Utilities/Layers_Utilities/{type}/{*path}">
        <Authentication Mode="PassThrough" />
        <RemoteEndpoint BaseAddress="https://adapter.caymanlandinfo.ky/secure/rest/services/Layers_Utilities" Address="MapServer/{*path}" />
        <ResolveCodesToNames Enabled="true" />
      </Shaper>
    </GeoRestShaper>
  </Modules>
  <Modules>
    <GeoRestShaper>
      <Forwarder Address="local-proxy/_Master/Basemap_AerialHybrid_2013/Basemap_AerialHybrid_2013/{type}/{*path}">
        <Authentication Mode="PassThrough" />
        <RemoteEndpoint BaseAddress="https://adapter.caymanlandinfo.ky/secure/rest/services/Basemap_AerialHybrid_2013" Address="{type}/{*path}" />
      </Forwarder>
    </GeoRestShaper>
  </Modules>
  <Modules>
    <GeoRestShaper>
      <Forwarder Address="local-proxy/_Master/Basemap_IvanFlood/Basemap_IvanFlood/{type}/{*path}">
        <Authentication Mode="PassThrough" />
        <RemoteEndpoint BaseAddress="https://adapter.caymanlandinfo.ky/secure/rest/services/Basemap_IvanFlood" Address="{type}/{*path}" />
      </Forwarder>
    </GeoRestShaper>
  </Modules>
  <Modules>
    <GeoRestShaper>
      <Forwarder Address="local-proxy/_Master/Basemap_Satellite_2004/Basemap_Satellite_2004/{type}/{*path}">
        <Authentication Mode="PassThrough" />
        <RemoteEndpoint BaseAddress="https://adapter.caymanlandinfo.ky/secure/rest/services/Basemap_Satellite_2004" Address="{type}/{*path}" />
      </Forwarder>
    </GeoRestShaper>
  </Modules>
  <Modules>
    <GeoRestShaper>
      <Shaper Address="local-proxy/_Master/Layers_Planning/Layers_Planning/{type}/{*path}">
        <Authentication Mode="PassThrough" />
        <RemoteEndpoint BaseAddress="https://adapter.caymanlandinfo.ky/secure/rest/services/Layers_Planning" Address="MapServer/{*path}" />
        <ResolveCodesToNames Enabled="true" />
      </Shaper>
    </GeoRestShaper>
  </Modules>
  <Modules>
    <GeoRestShaper>
      <Forwarder Address="local-proxy/_Master/Basemap_Aerial_2004/Basemap_Aerial_2004/{type}/{*path}">
        <Authentication Mode="PassThrough" />
        <RemoteEndpoint BaseAddress="https://adapter.caymanlandinfo.ky/secure/rest/services/Basemap_Aerial_2004" Address="{type}/{*path}" />
      </Forwarder>
    </GeoRestShaper>
  </Modules>
  <Modules>
    <GeoRestShaper>
      <Forwarder Address="local-proxy/_Master/Basemap_Aerial_1994/Basemap_Aerial_1994/{type}/{*path}">
        <Authentication Mode="PassThrough" />
        <RemoteEndpoint BaseAddress="https://adapter.caymanlandinfo.ky/secure/rest/services/Basemap_Aerial_1994" Address="{type}/{*path}" />
      </Forwarder>
    </GeoRestShaper>
  </Modules>
  <Modules>
    <GeoRestShaper>
      <Forwarder Address="local-proxy/_Master/Basemap_Aerial_2013_IR/Basemap_Aerial_2013_IR/{type}/{*path}">
        <Authentication Mode="PassThrough" />
        <RemoteEndpoint BaseAddress="https://adapter.caymanlandinfo.ky/secure/rest/services/Basemap_Aerial_2013_IR" Address="{type}/{*path}" />
      </Forwarder>
    </GeoRestShaper>
  </Modules>
  <Modules>
    <GeoRestShaper>
      <Forwarder Address="local-proxy/_Master/Basemap_Aerial_2008/Basemap_Aerial_2008/{type}/{*path}">
        <Authentication Mode="PassThrough" />
        <RemoteEndpoint BaseAddress="https://adapter.caymanlandinfo.ky/secure/rest/services/Basemap_Aerial_2008" Address="{type}/{*path}" />
      </Forwarder>
    </GeoRestShaper>
  </Modules>
  <Modules>
    <GeoRestShaper>
      <Shaper Address="local-proxy/_Master/Layers_ID_Cadastral/Layers_ID_Cadastral_Revised/{type}/{*path}">
        <Authentication Mode="PassThrough" />
        <RemoteEndpoint BaseAddress="https://adapter.caymanlandinfo.ky/secure/rest/services/Layers_ID_Cadastral_Revised" Address="MapServer/{*path}" />
        <ResolveCodesToNames Enabled="true" />
      </Shaper>
    </GeoRestShaper>
  </Modules>
  <Modules>
    <GeoRestShaper>
      <Forwarder Address="local-proxy/_Master/Basemap_Aerial_1999/Basemap_Aerial_1999/{type}/{*path}">
        <Authentication Mode="PassThrough" />
        <RemoteEndpoint BaseAddress="https://adapter.caymanlandinfo.ky/secure/rest/services/Basemap_Aerial_1999" Address="{type}/{*path}" />
      </Forwarder>
    </GeoRestShaper>
  </Modules>
  <Modules>
    <GeoRestShaper>
      <Forwarder Address="local-proxy/_Master/Basemap_Aerial_1971/Basemap_Aerial_1971/{type}/{*path}">
        <Authentication Mode="PassThrough" />
        <RemoteEndpoint BaseAddress="https://adapter.caymanlandinfo.ky/secure/rest/services/Basemap_Aerial_1971" Address="{type}/{*path}" />
      </Forwarder>
    </GeoRestShaper>
  </Modules>
  <Modules>
    <GeoRestShaper>
      <Shaper Address="local-proxy/_Master/Layers_ID_Base/Layers_ID_Base/{type}/{*path}">
        <Authentication Mode="PassThrough" />
        <RemoteEndpoint BaseAddress="https://adapter.caymanlandinfo.ky/secure/rest/services/Layers_ID_Base" Address="MapServer/{*path}" />
        <ResolveCodesToNames Enabled="true" />
      </Shaper>
    </GeoRestShaper>
  </Modules>
  <Modules>
    <GeoRestShaper>
      <Forwarder Address="local-proxy/_Master/0/Layers_Survey/{type}/{*path}">
        <Authentication Mode="PassThrough" />
        <RemoteEndpoint BaseAddress="https://adapter.caymanlandinfo.ky/secure/rest/services/Layers_Survey" Address="{type}/{*path}" />
      </Forwarder>
    </GeoRestShaper>
  </Modules>
</RestAppSettings>